{
  "artifact_type": "frame_challenge_result",
  "result_id": "batch1-frame-challenge-contradiction-to-review-primary",
  "subject_ref": "examples/studio/scenarios/contradiction-to-review/scenario.json",
  "input_preflight_ref": "examples/studio/frame-delta/batch1/cases/05-contradiction-to-review-primary/delta-preflight.json",
  "passes_run": [
    "counterframe_probe",
    "signal_gap_probe"
  ],
  "challenge_findings": [
    "The baseline contradiction route remains the correct destination.",
    "Delta mainly improves how visibly unresolved the evidence gap remains inside that route."
  ],
  "challenge_outcome": "confirmed",
  "frame_risk_band_after_challenge": "medium",
  "residual_risks": [
    "A polished hold posture can still imply more evidentiary confidence than is warranted."
  ],
  "recommended_next_move": "proceed_with_caution",
  "shadow_only": true,
  "non_authoritative": true
}
