{
  "artifact_type": "frame_challenge_result",
  "result_id": "batch1-frame-challenge-idea-to-proposal-primary",
  "subject_ref": "examples/studio/scenarios/idea-to-proposal/scenario.json",
  "input_preflight_ref": "examples/studio/frame-delta/batch1/cases/01-idea-to-proposal-primary/delta-preflight.json",
  "passes_run": [
    "constraint_skeptic"
  ],
  "challenge_findings": [
    "The baseline frame is already appropriately narrow and does not hide a truth or runtime jump.",
    "Extra shadow pressure would mostly restate constraints that are already visible."
  ],
  "challenge_outcome": "confirmed",
  "frame_risk_band_after_challenge": "low",
  "residual_risks": [
    "A reader could still overcomplicate a simple proposal-only path."
  ],
  "recommended_next_move": "proceed",
  "shadow_only": true,
  "non_authoritative": true
}
