{
  "artifact_type": "frame_challenge_result",
  "result_id": "batch1-frame-challenge-false-consensus-repair",
  "subject_ref": "examples/studio/frame-delta/scenarios/contradiction-to-review-shadow.scenario.json",
  "input_preflight_ref": "examples/studio/frame-delta/batch1/cases/09-false-consensus-repair/delta-preflight.json",
  "passes_run": [
    "counterframe_probe",
    "signal_gap_probe"
  ],
  "challenge_findings": [
    "The baseline route remains correct, but the frame needed active resistance against false consensus.",
    "Delta preserves contradiction visibility better than a purely coherent baseline reading."
  ],
  "challenge_outcome": "confirmed",
  "frame_risk_band_after_challenge": "medium",
  "residual_risks": [
    "Future readers may still mistake coherence for consensus if the warning language weakens."
  ],
  "recommended_next_move": "proceed_with_caution",
  "shadow_only": true,
  "non_authoritative": true
}
