{
  "artifact_type": "frame_challenge_result",
  "result_id": "batch1-frame-challenge-idea-to-handoff-primary",
  "subject_ref": "examples/studio/scenarios/idea-to-handoff/scenario.json",
  "input_preflight_ref": "examples/studio/frame-delta/batch1/cases/03-idea-to-handoff-primary/delta-preflight.json",
  "passes_run": [
    "constraint_skeptic"
  ],
  "challenge_findings": [
    "The baseline handoff path already expresses the meaningful gates and forbidden destinations.",
    "Delta adds confirmation more than net new framing correction."
  ],
  "challenge_outcome": "confirmed",
  "frame_risk_band_after_challenge": "low",
  "residual_risks": [
    "Some readers may still overread handoff as runtime readiness, but the baseline gates already counter that."
  ],
  "recommended_next_move": "proceed",
  "shadow_only": true,
  "non_authoritative": true
}
